{
  "$schema": "https://json-schema.org/draft/2020-12/schema",
  "$id": "stepmeld/order.v1",
  "title": "One Run's work in the shared store, pinned to one Worker or open to any that may take it. The Orchestrator writes the request and any cancel; the Worker claims it under a lease and writes the report.",
  "type": "object",
  "required": [
    "contract",
    "id",
    "placed",
    "request"
  ],
  "additionalProperties": false,
  "properties": {
    "contract": {
      "const": "stepmeld/order.v1"
    },
    "id": {
      "type": "string",
      "minLength": 1,
      "description": "The Run's id: one order per Run."
    },
    "worker": {
      "type": "string",
      "minLength": 1,
      "description": "The Worker it is pinned to. Absent on an open order."
    },
    "open": {
      "type": "object",
      "additionalProperties": false,
      "description": "Who may take an open order: any Worker that has the request's program, offers every word in `requires`, and is a cloud Worker or not as `cloud` says.",
      "properties": {
        "cloud": {
          "type": "boolean"
        },
        "requires": {
          "type": "array",
          "items": {
            "type": "string",
            "minLength": 1
          }
        }
      }
    },
    "placed": {
      "$ref": "#/$defs/time"
    },
    "request": {
      "$ref": "#/$defs/request"
    },
    "cancel": {
      "type": "object",
      "required": [
        "reason",
        "at"
      ],
      "additionalProperties": false,
      "description": "A cancel asked for by an Orchestrator; the first ask stands.",
      "properties": {
        "reason": {
          "type": "string"
        },
        "at": {
          "$ref": "#/$defs/time"
        }
      }
    },
    "claim": {
      "type": "object",
      "required": [
        "worker",
        "at",
        "until"
      ],
      "additionalProperties": false,
      "description": "The Worker's hold on the order, taken by a conditional write and kept by renewing it before `until`; once `until` has passed, a portable handle may be taken over by another Worker and a local one ends the order lost.",
      "properties": {
        "worker": {
          "type": "string",
          "minLength": 1
        },
        "at": {
          "$ref": "#/$defs/time",
          "description": "When this Worker took the order."
        },
        "until": {
          "$ref": "#/$defs/time",
          "description": "Until when the claim holds unless renewed."
        },
        "handle": {
          "type": "string",
          "description": "The Performer's handle, once the work has started."
        },
        "portable": {
          "type": "boolean",
          "description": "Whether the handle means anything on another machine (a cloud job's id does)."
        }
      }
    },
    "report": {
      "type": "object",
      "required": [
        "at"
      ],
      "additionalProperties": false,
      "description": "The claiming Worker's latest word: progress while it runs, the outcome once it ends (final). An order nobody took may be ended canceled, and one whose local claim lapsed ended lost, by an Orchestrator. The log is kept beside the order, appended as it grows, and is not part of this document.",
      "properties": {
        "at": {
          "$ref": "#/$defs/time"
        },
        "progress": {
          "$ref": "#/$defs/progress"
        },
        "outcome": {
          "$ref": "#/$defs/outcome"
        }
      }
    }
  },
  "$defs": {
    "time": {
      "type": "string",
      "description": "RFC 3339, UTC, so that later sorts later."
    },
    "progress": {
      "type": "object",
      "required": [
        "at"
      ],
      "additionalProperties": false,
      "properties": {
        "phase": {
          "type": "string"
        },
        "done": {
          "type": "integer",
          "minimum": 0
        },
        "total": {
          "type": "integer",
          "minimum": 0
        },
        "unit": {
          "type": "string"
        },
        "at": {
          "$ref": "#/$defs/time"
        }
      }
    },
    "outcome": {
      "type": "object",
      "required": [
        "state"
      ],
      "additionalProperties": false,
      "properties": {
        "state": {
          "enum": [
            "succeeded",
            "failed",
            "canceled",
            "lost"
          ]
        },
        "class": {
          "type": "string",
          "description": "The failure's class, the Performer's word; `refused`, `fault` and `lost` are the engine's."
        },
        "reason": {
          "type": "string"
        },
        "summary": {
          "type": "object",
          "required": [
            "headline"
          ],
          "additionalProperties": false,
          "properties": {
            "headline": {
              "type": "string"
            },
            "details": {}
          }
        },
        "outputs": {
          "type": "object"
        },
        "metrics": {}
      }
    },
    "request": {
      "type": "object",
      "required": [
        "workflow",
        "step",
        "run",
        "definition",
        "inputs",
        "parameters",
        "outputs"
      ],
      "additionalProperties": false,
      "properties": {
        "workflow": {
          "type": "string",
          "minLength": 1
        },
        "step": {
          "$ref": "#/$defs/name"
        },
        "run": {
          "type": "string",
          "minLength": 1,
          "description": "The Run's id. A Performer asked twice for the same Run starts one program."
        },
        "definition": {
          "$ref": "#/$defs/ref",
          "description": "The verb: a program may perform several and picks by name."
        },
        "program": {
          "type": "string",
          "description": "The program the StepDefinition names; a Worker runs the command it registered under that name."
        },
        "needs": {
          "type": "object",
          "description": "What the StepDefinition says the work needs, to size it by."
        },
        "inputs": {
          "type": "object",
          "description": "Every Input that holds a Value, by name. Values are opaque JSON."
        },
        "parameters": {
          "type": "object",
          "description": "Every Parameter in effect (the verb's default where no Actor chose), by name."
        },
        "outputs": {
          "type": "array",
          "description": "What a success must produce: each declared Output, by name and tag.",
          "items": {
            "type": "object",
            "required": [
              "name",
              "tag"
            ],
            "additionalProperties": false,
            "properties": {
              "name": {
                "$ref": "#/$defs/port"
              },
              "tag": {
                "$ref": "#/$defs/tag"
              },
              "options": {
                "type": "array",
                "minItems": 1,
                "items": {
                  "type": "string"
                },
                "description": "Present on a Decision (tag `decision`): the words its Value may be."
              },
              "label": {
                "type": "string"
              }
            }
          }
        }
      }
    },
    "ref": {
      "type": "object",
      "required": [
        "name",
        "version"
      ],
      "additionalProperties": false,
      "properties": {
        "name": {
          "type": "string"
        },
        "version": {
          "type": "integer",
          "minimum": 1
        }
      }
    },
    "name": {
      "type": "string",
      "pattern": "^[^.\\s]+$",
      "description": "No dots: names are joined with ports by a dot."
    },
    "port": {
      "type": "string",
      "minLength": 1
    },
    "tag": {
      "type": "string",
      "minLength": 1,
      "description": "An opaque label, compared for equality."
    }
  },
  "oneOf": [
    {
      "required": [
        "worker"
      ],
      "not": {
        "required": [
          "open"
        ]
      }
    },
    {
      "required": [
        "open"
      ],
      "not": {
        "required": [
          "worker"
        ]
      }
    }
  ]
}
